{
  "$schema": "https://json-schema.org/draft/2020-12/schema",
  "title": "Local AI Preflight Result",
  "type": "object",
  "additionalProperties": false,
  "required": [
    "schema_version",
    "tool_version",
    "decision",
    "exit_code",
    "status",
    "reasons",
    "artifact_dir",
    "summary_path",
    "result_path",
    "created_at",
    "repo_name",
    "run_id"
  ],
  "properties": {
    "schema_version": {
      "type": "string",
      "const": "1"
    },
    "tool_version": {
      "type": "string",
      "minLength": 1
    },
    "decision": {
      "type": "string",
      "enum": [
        "continue",
        "review",
        "stop"
      ]
    },
    "exit_code": {
      "type": "integer",
      "enum": [
        0,
        1,
        2
      ]
    },
    "status": {
      "type": "string",
      "enum": [
        "ok",
        "not_git_repo",
        "probe_failed",
        "summarize_failed"
      ]
    },
    "reasons": {
      "type": "array",
      "items": {
        "type": "string",
        "enum": [
          "not_git_repo",
          "git_repo",
          "ollama_probe_failed",
          "ollama_probe_ok",
          "summary_skipped",
          "summarize_failed",
          "summary_created"
        ]
      },
      "minItems": 1,
      "uniqueItems": true
    },
    "artifact_dir": {
      "type": "string",
      "minLength": 1
    },
    "summary_path": {
      "type": "string",
      "minLength": 1
    },
    "result_path": {
      "type": "string",
      "minLength": 1
    },
    "created_at": {
      "type": "string",
      "pattern": "^\\d{4}-\\d{2}-\\d{2}T\\d{2}:\\d{2}:\\d{2}\\.\\d{3}Z$"
    },
    "repo_name": {
      "type": [
        "string",
        "null"
      ]
    },
    "run_id": {
      "type": "string",
      "pattern": "^\\d{8}T\\d{6}Z$"
    }
  },
  "oneOf": [
    {
      "properties": {
        "decision": {
          "const": "continue"
        },
        "exit_code": {
          "const": 0
        },
        "status": {
          "const": "ok"
        },
        "reasons": {
          "const": [
            "git_repo",
            "ollama_probe_ok",
            "summary_skipped"
          ]
        }
      }
    },
    {
      "properties": {
        "decision": {
          "const": "continue"
        },
        "exit_code": {
          "const": 0
        },
        "status": {
          "const": "ok"
        },
        "reasons": {
          "const": [
            "git_repo",
            "ollama_probe_ok",
            "summary_created"
          ]
        }
      }
    },
    {
      "properties": {
        "decision": {
          "const": "review"
        },
        "exit_code": {
          "const": 1
        },
        "status": {
          "const": "probe_failed"
        },
        "reasons": {
          "const": [
            "git_repo",
            "ollama_probe_failed"
          ]
        }
      }
    },
    {
      "properties": {
        "decision": {
          "const": "review"
        },
        "exit_code": {
          "const": 1
        },
        "status": {
          "const": "summarize_failed"
        },
        "reasons": {
          "const": [
            "git_repo",
            "ollama_probe_ok",
            "summarize_failed"
          ]
        }
      }
    },
    {
      "properties": {
        "decision": {
          "const": "stop"
        },
        "exit_code": {
          "const": 2
        },
        "status": {
          "const": "not_git_repo"
        },
        "reasons": {
          "const": [
            "not_git_repo"
          ]
        }
      }
    }
  ]
}
