{
  "schema_version": "1",
  "tool_version": "0.1.0",
  "decision": "continue",
  "exit_code": 0,
  "status": "ok",
  "reasons": [
    "git_repo",
    "ollama_probe_ok",
    "summary_created"
  ],
  "artifact_dir": "artifacts/2026-05-09/20260509T000000Z",
  "summary_path": "artifacts/2026-05-09/20260509T000000Z/summary.md",
  "result_path": "artifacts/2026-05-09/20260509T000000Z/result.json",
  "created_at": "2026-05-09T00:00:00.000Z",
  "repo_name": "demo-repo",
  "run_id": "20260509T000000Z"
}
